"Story","Title","Result","Date","Stability","Duration (s)"
"Neuron IT","Neurons accept input","SUCCESS","2021-12-16T23:13:49.296993+01:00[Europe/Berlin]","0.0","0.01"
"Neuron IT","Output from multiple inputs is taken into account","SUCCESS","2021-12-16T23:13:49.306062+01:00[Europe/Berlin]","0.0","0.02"
"Neuron IT","Neurons keep track of multiple inputs","SUCCESS","2021-12-16T23:13:49.327913+01:00[Europe/Berlin]","0.0","0.02"
"Neuron IT","Neurons send out value between zero and one","SUCCESS","2021-12-16T23:13:49.347648+01:00[Europe/Berlin]","0.0","0.02"
"Neuron IT","When accepting an input the sigmoid function is applied and sent to the output","SUCCESS","2021-12-16T23:13:49.369272+01:00[Europe/Berlin]","0.0","0.17"
"Neuron IT","Neurons have bias","SUCCESS","2021-12-16T23:13:49.543515+01:00[Europe/Berlin]","0.0","0.01"
"Neuron IT","Neurons have sigmoid function","SUCCESS","2021-12-16T23:13:49.553062+01:00[Europe/Berlin]","0.0","0.01"
