"Story","Title","Result","Date","Stability","Duration (s)"
"Neuron IT","Neurons accept input","SUCCESS","2021-12-07T22:58:11.961791+01:00[Europe/Berlin]","0.0","0.01"
"Neuron IT","Output from multiple inputs is taken into account","SUCCESS","2021-12-07T22:58:11.971863+01:00[Europe/Berlin]","0.0","0.02"
"Neuron IT","Neurons keep track of multiple inputs","SUCCESS","2021-12-07T22:58:11.997295+01:00[Europe/Berlin]","0.0","0.01"
"Neuron IT","Neurons send out value between zero and one","SUCCESS","2021-12-07T22:58:12.011905+01:00[Europe/Berlin]","0.0","0.01"
"Neuron IT","When accepting an input the sigmoid function is applied and sent to the output","SUCCESS","2021-12-07T22:58:12.024264+01:00[Europe/Berlin]","0.0","0.15"
"Neuron IT","Neurons have bias","SUCCESS","2021-12-07T22:58:12.172323+01:00[Europe/Berlin]","0.0","0.01"
"Neuron IT","Neurons have sigmoid function","SUCCESS","2021-12-07T22:58:12.179946+01:00[Europe/Berlin]","0.0","0.01"
